data_source_id,data_source_name,data_source_description,document_url,source_version,collection_start_date,collection_end_date,last_updated_date
,Pre-Generated Data Files for EPA AQS Site and Monitor Descriptions: United States Environmental Protection Agency (EPA) Air Quality System (AQS).,"The Air Quality System (AQS) contains ambient air pollution data collected by EPA, state, local, and tribal air pollution control agencies from over thousands of monitors across the United States. See https://aqs.epa.gov/aqsweb/airdata/download_files.html for downloads and https://aqs.epa.gov/aqsweb/airdata/FileFormats.html for data dictionaries.",https://aqs.epa.gov/aqsweb/airdata/aqs_sites.zip,,,,12/31/20
,Pre-Generated Data Files for EPA AQS Nationwide 2020 Daily Measures of PM2.5 at AQS Sites: United States Environmental Protection Agency (EPA) Air Quality System (AQS).,"The Air Quality System (AQS) contains ambient air pollution data collected by EPA, state, local, and tribal air pollution control agencies from over thousands of monitors across the United States. See https://aqs.epa.gov/aqsweb/airdata/download_files.html for downloads and https://aqs.epa.gov/aqsweb/airdata/FileFormats.html for data dictionaries.",https://aqs.epa.gov/aqsweb/airdata/daily_88101_2020.zip,,1/1/20,12/31/20,12/31/20
,Pre-Generatd Data Files for CDC SVI by Census Tract: Center for Diseasae Control (CDC) Social Vulnerability Index (SVI).,"The CDC/ATSDR Social Vulnerability Index (CDC/ATSDR SVI) uses 15 U.S. census variables to help local officials identify communities that may need support before, during, or after disasters. See https://www.atsdr.cdc.gov/placeandhealth/svi/index.html for a description and https://www.atsdr.cdc.gov/placeandhealth/svi/data_documentation_download.html for download and data documentation.",https://svi.cdc.gov/Documents/Data/<YEAR>_SVI_data/<GEOM>.zip,,,,
,United States Census Tracts,,https://www2.census.gov/geo/tiger/TIGER,,,,
,United States Counties,,https://www2.census.gov/geo/tiger/TIGER,,,,