concept_id,concept_synonym_name,language_concept_id
2051502529,"6-Methyl-1,3,8-trihydroxy-9,10-anthracenedione; Schuttgelb; 4,5,7-Trihydroxy-2-methylanthraquinone; Archin; Rheum-emodin; 6-Methyl-1,3,8-trihydroxyanthraquinone; 9,10-Anthracenedione, 1,3,8-trihydroxy-6-methyl- (9CI); 1,3, 8-Trihydroxy-6-methyl-9,10-anthr",4180186
2051502533,SDOHO:52; Spirituality_and_Religion_Practice,4180186
2051502535,Spiresis; Spironolattone; Osyrol; Aldactone; Verospiron; Spiretic; Xenalon; Uractone; Spironolactonum; Espironolactona; Spiroctan; CHEBI:9241,4180186
2051502536,"Trifolitin; 3,5,7-Trihydroxy-2-(4-hydroxyphenyl)-4H-1-benzopyran-4-one; 3,5,7-Trihydroxy-2-(4-hydroxyphenyl)-4H-chromen-4-one; Kampferol; Kampherol; Populnetin; Rhamnolutein; 3,4',5,7-Tetrahydroxy-Flavone (7CI,8CI); CHEBI:28499",4180186
2051502539,"5,7-Dihydroxy-2-(4-hydroxyphenyl)-4-benzopyrone; 2-(p-Hydroxyphenyl)-5,7-dihydroxychromone; 4',5,7-Trihydroxy-Flavone; 4,5, 7-Trihydroxyflavone; 5,7-Dihydroxy-2-(4-hydroxyphenyl)-4H-chromen-4-one; Apigenol; Chamomile; Spigenin; Versulin; CHEBI:18388",4180186
2051502540,"Constituent of \magic mushrooms\; Psilocibin; 3-2'-Dimethylaminoethylindol-4-phosphate; Psilocybine; Psilocybinum; Magic mushrooms; 3-2-(Dimethylamino)ethylindol-4-yl dihydrogen phosphate; Indocybin; 4-Phosphoryloxy-omega-N,N-dimethyltryptamine; 3-(2-Dime",4180186
2051502541,"Psilocine; 3-(2-(Dimethylamino)ethyl)indol-4-ol; 3-2-(Dimethylamino)ethyl-1H-Indol-4-ol; Psilotsin; N,N-Dimethyl-4-Hydroxytryptamine; 4-Hydroxy-N,N-dimethyltryptamine; 3-2-(Dimethylamino)ethyl-Indol-4-ol; CHEBI:8613",4180186
2051502543,"Stanorone; 17-Hydroxyandrostan-3-one; 5-alpha-Androstanolone; 5-a-Androstanolone; 4-Dihydrotestosterone; 4,5a-Dihydrotestosterone; 17beta-Hydroxyandrostan-3-one; 17beta-Hydroxy-5alpha-androstane-3-one; 17beta-hydroxy-5alpha-androstan-3-one; 17b-Hydroxy-3-",4180186
2051502544,CI-898; Neutrexin; TMQ; TMX; Trimetrexato; Trimetrexatum; Trimetrexic acid; CHEBI:119101,4180186
2051502546,SDOHO:522; Age,4180186
2051502548,Thioplex; CHEBI:128310,4180186
2051502551,Ripcord; Polytrin; Nurelle; Nurele; Cyperkill; Barricade (insecticide); Rycopel; Kalif super; Kordon; Mustang; Kreokhin; Cyperil; Cypercopal; Cyperco; Cypercare; Cypemethrim; Cymperator; Cympa-ti; Antiborer 3767; Excis; Ectopor; Cymbush; Creokhin; Ectomin,4180186
2051502553,"2H-Furo2,3-H-1-benzopyran-2-one; Isopsoralin; Isopsoralen; Furo5',4':7,8coumarin; Furo2,3-hcoumarin; Bakuchicin; 4-Hydroxy-5-benzofuranacrylic acid gamma-lactone; 2H-Furo2,3-Hchromen-2-one; 3-(4-Hydroxy-5-benzofuranyl)-2-propenoic acid gamma-lactone; Ange",4180186
2051502557,"Buprenex; Tidigesic; Temgesic; Subutex; Probuphine; Norspan; (-)-Buprenorphine; (\u2212)-buprenorphine; 17-Cyclopropylmethyl-4,5alpha-epoxy-7alpha-((S)-1-hydroxy-1,2,2-trimethylpropyl)-6-methoxy-6,14-endo-ethanomorphinan-3-ol; 2-(N-Cyclopropylmethyl-4,5al",4180186
2051502559,Verasifar; Zolvera; Vortac; Novapamyl LP; Novo-Veramil; Nu-Verap; Vetrimil; Vertab; Verpamil; Veroptinstada; Verogalid ER; Verogalid; Vermine; Vermin; Verisop; Verelan SR; Verelan PM; Verelan; Verdilac; Akilen; Anpec; Apo-Verap; Arpamyl LP; Berkatens; Bos,4180186
2051502560,2-Phenyl-4-chromone; 2-Phenyl-4H-1-benzopyran-4-one; 2-Phenyl-4H-benzopyran-4-one; 2-Phenyl-4H-chromen-4-one; 2-Phenylbenzopyran-4-one; 2-Phenylchromone; CHEBI:42491,4180186
2051502562,"Nix; (3-Phenoxyphenyl)methyl (+-)-cis,trans-3-(2,2-dichloroethenyl)-2,2-dimethylcyclopropanecarboxylate; 3-(2,2-Dichloroethenyl)-2,2-dimethylcyclopropane carboxylic acid, (3-phenoxyphenyl) methyl ester; Acticin; Elimite; Lyclear; CHEBI:34911",4180186
2051502585,"(+-)-Trichlorfon; Metrifonatum; Metrifonato; Metrifonate; Methyl chlorophos; Chlorophos; 1-Hydroxy-2,2,2-trichloroethylphosphonic acid dimethyl ester; CHEBI:6908",4180186
2051502594,1-(3-P-Fluorobenzoylpropyl)-4-P-chlorophenyl-4-hydroxypiperidine; Duraperidol; 4'-Fluoro-4-(4-hydroxy-4-(4'-chlorophenyl)piperidino)butyrophenone; Dozic; 4'-Fluoro-4-(4-(P-chlorophenyl)-4-hydroxypiperidinyl)butyrophenone; Haldol; Brotopon; Bioperidolo; Ha,4180186
2051502597,(2R)-2-amino-3-sulfanylpropanoate; Cysteinum; (R)-(+)-cysteine; (2R)-2-amino-3-sulfanylpropanoic acid; Thioserine; Cystein; Cys; Cisteinum; Cysteine; Polycysteine; L-Cystein; L-Cys; L-2-Amino-3-mercaptopropionic acid; Cisteina; Carbocysteine; beta-Mercapt,4180186
2051502598,"Decamethrine; Butox; Zorcis; Suspend; Phagase 1; New Musigie; K-Othrine; K-Othrin; K-Obiol; Glossinex 200; Esbecythrin; Deltamethrine; Deltagran; DeltaGard; Dekametrin; Decis 2.5ULV; Decis 1.5ULV; (S)-cyano(3-phenoxyphenyl)methyl (1R,3R)-3-(2,2-dibromoeth",4180186
2051502600,"1,4-Pregnadiene-17alpha,21-diol-3,11,20-trione; Prednisona; Prednisonum; Rayos; Meticorten; Delta-Cortef; Orasone; 17,21-Dihydroxypregna-1,4-diene-3,11,20-trione; Dehydrocortisone; 1,2-Dehydrocortisone; CHEBI:8382",4180186
2051502603,Rapamycin; (-)-Rapamycin; Rapamune; CHEBI:9168,4180186
2051502606,"3-Hydroxy-17-keto-estra-1,3,5-triene; Folliculin; 3-Hydroxy-1,3,5(10)-estratrien-17-one; 1,3,5(10)-Estratrien-3-ol-17-one; Oestrone; follicular hormone; Estronum; Estrona; D1,3,5(10)-Estratrien-3-ol-17-one; 3-Hydroxyoestra-1,3,5(10)-trien-17-one; 3-Hydrox",4180186
2051502607,4-Carbamylphenyl biscarboxymethylthioarsenite; Thioarsenite; Thiacetarsamidum; Thiacetarsamide; P-(bis(carboxymethylmercapto)arsino)benzamide; Dithioglycolyl p-arsenobenzamide; Caparsolate; Capariside; Bis(carboxymethylmercapto)(p-carbamylphenyl)-arsine; ,4180186
2051502608,Levulose; delta-Fructose; lnulon; Fructon; beta-D-Fructose; FRU; Levugen; Fructose; Fructosteril; beta-delta-Arabino-hexulose; beta-delta-Fructofuranose; beta-delta-Fructose; beta-Fruit sugar; beta-Levulose; D-(-)-Fructose; delta-(-)-Fructose; beta-D-Arab,4180186
2051502610,"(-)-(S)-Equol; (S)-Equol; 4',7-Dihydroxyisoflavan; 4',7-Isoflavandiol; (-)-Equol; (S)-(-)-4',7-Isoflavandiol; (S)-3,4-dihydro-3-(4-Hydroxyphenyl)-2H-1-benzopyran-7-ol; CHEBI:428126",4180186
2051502613,Benzaldehyde cyanohydrin; Amygdalonitrile; Alpha-hydroxyphenylacetonitrile; Alpha-hydroxybenzeneacetonitrile; a-hydroxybenzeneacetonitrile; a-cyanobenzyl alcohol; 2-hydroxy-2-phenylacetonitrile; .alpha.-hydroxybenzeneacetonitrile; (+-)-alpha-hydroxybenzen,4180186
2051502616,"DMTT; Dimethylformocarbothialdine; Dazoberg; Crag 974; Basamid; 3,5-Dimethyltetrahydro-2H-1,3,5-thiadiazine-2-thione; 3,5-Dimethyltetrahydro-1,3,5-thiadiazine-2-thione; 3,5-Dimethyltetrahydro-1,3,5-2H-thiadiazine-2-thione; 3,5-Dimethyl-2-thionotetrahydro-",4180186
2051502618,"2, 4-Dinitro-o-cresol; Dekryll; Degrassan; Capsine; Arborol; Antinonnin; Antinonin; 6-Methyl-2,4-dinitrophenol; 4,6-DNOC; 4,6-Dinitro-O-cresol; 4,6-Dinitro-2-methylphenol; 3,5-Dinitro-2-hydroxytoluene; 3, 5-Dinitro-2-hydroxytoluene; 2-Methyl-4,6-dinitroph",4180186
2051502627,3-Carbamoyl-4-deacetyl-3-de(methoxycarbonyl)vincaleukoblastine; Vindesine Sulfate; Eldisine; Eldesine; Desacetylvinblastine Amide Sulfate; Desacetylvinblastine amide; 3-(Aminocarbonyl)-O(4)-deacetyl-3-de(methoxycarbonyl)vincaleukoblastine; CHEBI:36373,4180186
2051502629,"1,2:5,6-Benzanthracene; 1,2:5,6-Dibenz(a)anthracene; 1,2:5,6-Dibenzanthracene; 1,2:5,6-Dibenzoanthracene; Benzoktetraphene; Benza,hanthracene; DBA; Dibenz(a,h)anthracene; Dibenz(a,h)antracene; Dibenzathracene; Dibenzaa,h-anthracene; 1,2,5,6-Dibenzanthrace",4180186
2051502630,"Metamphetamine; Methylamphetamine; methyl-\u03b2-phenylisopropylamine; (S)-methamphetamine; (S)-methylamphetamine; (+ )-methylamphetamine; (+)-(S)-deoxyephedrine; (+)-(S)-N-alpha-dimethylphenethylamine; (+)-(S)-N-\u03b1-dimethylphenethylamine; (S)-N,alpha",4180186
2051502632,SDOHO:538; Social_Worker_Support,4180186
2051502634,Indomethacinum; 1-(p-chlorobenzoyl)-5-methoxy-2-methylindole-3-acetic acid; Indomethacine; Indometacyna; Mikametan; Nu-Indo; Reumacide; Tivorbex; Aconip; Arthrexin; Elmetacin; IMN; Indaflex; Indocid; Indocin; Indolar SR; Indomed; Indometacin; Indometacina,4180186
2051502636,citral B; Lemonal; FEMA 2303; Neral; CHEBI:29020,4180186
2051502640,"Aralen; Artrichin; Bemaphate; Capquin; Chloraquine; Chlorochin; N(4)-(7-chloro-4-Quinolinyl)-N(1),N(1)-diethyl-1,4-pentanediamine; Malarex; Cloroquina; Clorochina; Chlorochine; Chloroquina; Chlorquin; Chloroquinum; Nivaquine b; Resochin; Resoquine; Chloro",4180186
2051502642,Isooctane; Isobutyltrimethylmethane; Isobutyltrimethylethane; Iso-octane; (CH3)2CHCH2C(CH3)3; Trimethylpentane; CHEBI:62805,4180186
2051502644,SDOHO:541; Food_Bank,4180186
2051502647,"Nicotine Alkaloid; Nicotrol; Nikotin; (R,S)-nicotine; (+-)-Nicotine; (+-)-3-(1-Methyl-2-pyrrolidinyl)pyridine; Habitrol; Nicoderm; L-Nicotine; (RS)-nicotine; (\u00b1)-Nicotine; Nicoderm CQ; Nicorette; Nicotin; CHEBI:18723",4180186
2051502648,Carnipass 20; Carnipass; Carnilean; Carniking 50; Carniking; Carnicor; Carniben; Cardispan; Levocarnitina; Levocarnitine; Cardimax; Bitobionil; Biocarn; Bicarnesine; Aveptol; Albicar; 3-Hydroxy-4-trimethylammoniobutanoic acid; 3-Hydroxy-4-trimethylammonio,4180186
2051502650,"Almarytm; Tambocor; N-(2-Piperidinylmethyl)-2,5-bis(2,2,2-trifluoroethoxy)benzamide; Flecainidum; Flecainida; Flecaine; CCRIS 313; Apocard; (+-)-Flecainide; CHEBI:127588",4180186
2051502651,"m-phenylene dichloride; 1,3-dichlorobenzene; metadichlorobenzene; meta-dichlorobenzene; CHEBI:36693",4180186
2051502652,SDOHO:542; Food_Assistance,4180186
2051502654,(+/-)-2-Aminoadipate; L-alpha-Aminoadipate; L-alpha-Aminoadipic acid; a-Aminoadipic acid; L-2-Aminohexanedioic acid; L-2-Aminohexanedioate; DL-2-Aminohexanedioate; L-2-Aminoadipic acid; 2-Aminoadipic acid; a-Aminoadipate; 2-Aminoadipate; (+/-)-2-Aminoadip,4180186
2051502656,"Malonodialdehyde; 1,3-Propanedial; 1,3-Propanedialdehyde; 1,3-Propanedione; Malonaldehyde; Malonic aldehyde; Malonic dialdehyde; Malonyldialdehyde; MDD; Propanedial; CHEBI:566274",4180186
2051502662,Cadmium(II) acetate; ACT; ACY; Bis(acetoxy)cadmium; Cadmium ethanoate; Cadmium diacetate; Cadmium acetic acid; Cadmium di(acetate); Cadmium(2+) acetate; CHEBI:15366,4180186
2051502666,N-Tetradecan-1-oate; Tetradecanoic (Myristic) acid; Myristoate; N-Tetradecanoate; Myristoic acid; Tetradecanoic acid; N-Tetradecan-1-oic acid; 1-Tridecanecarboxylate; 1-Tridecanecarboxylic acid; Crodacid; N-Tetradecanoic acid; Tetradecanoate; Myristic aci,4180186
2051502668,(CH3)2Zn; Methylzinc; ZnMe2; Qmbaxch; Dimethyl zinc; Zinc methyl; CHEBI:51497,4180186
2051502669,SDOHO:545; Master's_Degree,4180186
2051502676,"Chlorethoxyphos; O,O-Diethyl O-(1,2,2,2-tetrachloroethyl) thiophosphate; Chloroethoxyfos; CHEBI:CHEBI:38590",4180186
2051502678,"4'-Amino-folsaeure; 4-Aminofolic acid; N-(4-{(2,4-Diamino-6-pteridinyl)methylamino}benzoyl)glutamic acid; Minopterin; L-N-p-(2,4-Diamino-6-pteridinyl)methylaminobenzoyl-Glutamic acid; APGA; Aminopterine; Aminopteridine; A-ninopterin; 4-Aminopteroylglutami",4180186
2051502679,Sodium salt of 2-(carboxyphenyl)thioethylmercury; ((o-carboxyphenyl)thio) ethylmercury sodium salt; 2-(Ethylmercuriomercapto)benzoic acid sodium salt; Estivin; Ethyl (sodium o-mercaptobenzoato)mercury; ethyl(2-mercaptobenzoato-S)mercury sodium salt; Ethyl,4180186
2051502681,"Pilocarpine hydrochloride; Pilovisc; Pilocarpine HCl; Pilocarpine chloride; Pilocarpin; (3S-cis)-3-Ethyldihydro-4-(1-methyl-1H-imidazol-5-yl)methyl-2(3H)-furanone; (3S,4R)-3-Ethyldihydro-4-((1-methyl-1H-imidazol-5-yl)methyl)-2(3H)-furanone; Pilostat; Pilo",4180186
2051502682,Faverin; Dumirox; Fevarin; Floxyfral; Fluvoxamina; Maveral; Fluvoxamine maleate; Fluvoxamine-CR; Fluvoxaminum; Luvox; CHEBI:5138,4180186
2051502683,SDOHO:548; Bachelor's_Degree,4180186
2051502687,Isonicotinylhydrazine; Isonicotinyl hydrazine; Isonicotinyl hydrazide; Rimifon; Servizid; Tibinide; Isohydrazide; INH; Isonicotinhydrazid; Isonicotinic acid hydrazide; Isonicotinic hydrazide; Isonicotinohydrazide; Hydrazide; Hydrazid; HIA; 4-pyridinecarbo,4180186
2051502688,"Animex-On; Sarafem; (+-)-N-Methyl-gamma-(4-(trifluoromethyl)phenoxy)benzenepropanamine; (+-)-N-Methyl-3-phenyl-3-((alpha,alpha,alpha-trifluoro-P-tolyl)oxy)propylamine; Ladose; Fluoxeren; Prozac; Fluox\u00e9tine; Fluoxetina; Fluoxetin; Fontex; Fluoxetinum;",4180186
2051502689,Albenza; Valbazen; Rycobendazole; O-Methyl N-(5-(propylthio)-2-benzimidazolyl)carbamate; Proftril; Ricobendazole; Eskazole; Despar; Dalben; Clearworm; Cidazole; Ciclopar; Champs; Cental; Buxol; Bruzol; Biwom; Bevindazol; Benzole; Zentel; Zolben; Benzol; B,4180186
2051502692,SDOHO:551; Associate_Degree,4180186
2051502699,Sheriff; RCRA waste no. P189; Marshal/suscon; Posse; Caswell No. 463C; Dibutylaminosulfenylcarbofuran; Marshal; Marshal 10G; Marshall 10G; Marshall; Advantage; CHEBI:38476,4180186
2051502701,"Porphyrinogen IX; PpIX; Protoporphyrin; Protoporphyrin-IX; Ooporphyrin; Kammerer'S prophyrin; 3,3'-(3,7,12,17-Tetramethyl-8,13-divinylporphine-2,18-diyl)di; 3,3'-(3,7,12,17-Tetramethyl-8,13-divinyl-21H,23H-porphine-2,18-diyl)-bis-propionic acid; 3,3'-(3,7",4180186
2051502704,"4-Methylmercapto-3-methylphenyl dimethyl thiophosphate; Phosphorothioic acid, O,O-dimethyl O-(3-methyl-4-(methylthio)phenyl) ester; Mercaptophos; O,O-Dimethyl-O-4-(methylmercapto)-3-methylphenyl thiophosphate; O,O-Dimethyl O-3-methyl-4-(methylsulfanyl)phe",4180186
2051502705,SDOHO:554; College_Completed,4180186
2051502707,"Manihotoxin; Phaseolunatin; 1-Cyano-1-methylethyl beta-D-glucoside; 2-(b-D-Glucopyranosyloxy)-2-methylpropanenitrile, 9CI; 2-(beta-D-Glucopyranosyloxy)-2-methyl-Propanenitrile; 2-(beta-D-Glucopyranosyloxy)-2-methylpropanenitrile; alpha-Hydroxyisobutyronit",4180186
2051502709,Alpha medopa; alpha-Methyl dopa; alpha-methyl-L-dopa; Alphamethyldopa; AMD; Dopamet; Hypolag; L-alpha-Methyldopa; L-Methyl Dopa; Medomet; Medopren; Novomedopa; Nu-Medopa; Aldomin; Aldometil; Aldomet; 3-Hydroxy-alpha-methyl-L-tyrosine; (S)-(-)-alpha-Methyl,4180186
2051502712,"CCCP; CCP; M-chlorophenyl carbonylcyanide hydrazone; M-CL-CCP; Mesoxalonitrile 3-chlorophenylhydrazone; Mesoxalonitrile, (m-chlorophenyl)hydrazone; Carbonyl cyanide meta chlorophenyl hydrazone; Mesoxalonitrile, (m-chlorophenyl)hydrazone (8CI); N'-(3-chlor",4180186
2051502714,SDOHO:556; PhD_Degree,4180186
2051502716,"(RS)-3-hydroxy-1,2-epoxypropane; 2,3-Epoxy-1-propanol; 3-Hydroxypropylene oxide; 3-Hydroxy-1,2-epoxypropane; Oxiranemethanol; CHEBI:CHEBI:30966",4180186
2051502717,"Isothiocyanatomethane; Isothiocyanato-Methane; Biomet 33; Vorlex; Vortex; MIC; MIT; MITC; Mencs; Isothiocyanic acid, methyl ester; MTC; Trapex; Trapex-40; Trapexide; Tropex; (methylimino)thioxo-Methane; (methylimino)(thioxo)methane; Methyl thioisocyanate;",4180186
2051502718,"Methyl rhodanate; Methylthiokyanat; Methylrhodanid; Methyl thiocyanide; Methyl thiocyanic acid; Methyl sulfocyanate; CH3SCN; MeSCN; Thiocyanic acid,methyl ester; CHEBI:61112",4180186
2051502722,"2,3,6-PCB; PCB 24; 2,3,6-Trichloro-1,1'-biphenyl; CHEBI:34225",4180186
2051502723,"Trichloro-1,1'-biphenyl; 2,3,4-PCB; Apirolio 1431 C; 2,3,4-Trichloro-1,1'-biphenyl; PCB 21; Pyranol 1499; CHEBI:34222",4180186
2051502728,Diethyl zinc; Zinc diethyl; (C2H5)2Zn; Zinc ethide; DEZ; ZnEt2; Zincdiethyl; Zinc ethyl; Diethylzinc solution; Diethylzink; CHEBI:51496,4180186
2051502732,"Acetic acid, zinc(II) salt; Acetic acid, zinc salt; Zinc diacetate; Zinc acetic acid; Dicarbomethoxyzinc; CHEBI:62984",4180186
2051502736,"Methane, tetrabromide; CBr4; Carbon tetrabromide; Carbon bromide (CBr4); Carbon bromide; Bromid uhlicity; Kohlenstofftetrabromid; Methane tetrabromide; Tetrabromidocarbon; Tetrabromkohlenstoff; Tetrabrommethan; WLN: exeee; CHEBI:47875",4180186
2051502737,Thioridazine Thiomethyl Sulfoxide; thioridazine-2-sulfoxide; TPS-23; TPS23; 10-(2-(1-Methyl-2-piperidyl)ethyl)-2-methylsulfinyl phenothiazine; 10-(2(1-Methyl-2-piperidyl)ethyl)-2-(methylsulfinyl)phenothiazine; Serentil; Mesoridazinum; 2-Methanesulfinyl-10,4180186
2051502738,SDOHO:559; Safe_Sex,4180186
2051502739,Buzulfan; Tetramethylenester Kyseliny Methansulfonove; Tetramethylene Dimethane Sulfonate; Tetramethylene bis(methanesulfonate); Sulphabutin; Sulfabutin; Myleran; Myeloleukon; Mitostan; Misulban; Mielucin; Mablin; Leucosulfan; Butanedioldimethanesulfonate,4180186
2051502740,"Chlorpyrifos O,O-dimethyl analog; Methyl chlorpyriphos; O,O-Dimethyl O-(3,5,6-trichloro-2-pyridyl) phosphorothioate; O,O-Dimethyl O-(3,5,6-trichloropyridin-2-yl) thiophosphate; O,O-Dimethyl-O-(3,5,6-trichloro-2-pyridyl)phosphorothioate; Phosphorothioic ac",4180186
2051502742,Ensure universal access to sexual and reproductive health and reproductive rights as agreed in accordance with the Programme of Action of the International Conference on Population and Development and the Beijing Platform for Action and the outcome docume,4180186
2051502744,Sufenta Forte; Sufenta; N-(4-(Methoxymethyl)-1-(2-(2-thienyl)ethyl)-4-piperidyl)propionanilide; N-(4-(Methoxymethyl)-1-(2-(2-thienyl)ethyl)-4-piperidinyl)-N-phenylpropanamide; Fastfen; Disufen; Chronogesic; Zuftil; Sufentil; Sufentanyl; Sufentanilum; Sufe,4180186
2051502751,Gaballon; GABA; g-Aminobutyric acid; g-Aminobutyrate; Aminalon; 4-Aminobutyric acid; 4-Aminobutyrate; 4-Aminobutanoic acid; 4-Aminobutanoate; 3-Carboxypropylamine; Piperidinate; w-Aminobutyrate; w-Aminobutyric acid; \u03b3-Aminobutyrate; \u03b3-Aminobutyr,4180186
2051502752,"diamorphine; diacetylmorphine; 7,8-Dihydro-4,5-alpha-epoxy-17-methylmorphinan-3,6-alpha-diol diacetate; O,O'-diacetylmorphine; morphine diacetate; 3,6-Diacetylmorphine; (5alpha,6alpha)-7,8-Didehydro-4,5-epoxy-17-methylmorphinan-3,6-diol diacetate (ester);",4180186
2051502754,"11b,18,21-Trihydroxy-pregn-4-ene-3,20-dione; CHEBI:16485",4180186
2051502755,SDOHO:562; Condomless_Sex,4180186
2051502757,Carbontetrachloride; Necatorine; Methane tetrachloride; Carbon tet; Tetrachloro-Methane; Carbon chloride; Tetrasol; Tetrachloromethane; Perchloromethane; CHEBI:27385,4180186
2051502760,"5-Cyclohex-1-enyl-1,5-dimethyl-pyrimidine-2,4,6-trione; Tobinal; Methylhexabital; Methexenyl; Hexobarbitone; Evipan; 5-(1-Cyclohexen-1-yl)-1,5-dimethyl-2,4,6(1H,3H,5H)-pyrimidinetrione; 5-(1-Cyclohexen-1-yl)-1,5-dimethylbarbituric acid; Evipal; CHEBI:5706",4180186
2051502761,"RP-thion; Trecator-SC; Tetraethyl S,S'-methylene bis(phosphorothiolothionate); Soprathion; Vegfru fosmite; Vegfru-fosmite; Bis(s-(diethoxyphosphinothioyl)mercapto)methane; Diethion; Embathion; Ethanox; Ethiol; Ethodan; Ethopaz; Ethyl methylene phosphorodi",4180186
2051502765,Isopentene; Vinylisopropyl; Isopropylethylene; Alpha-isoamylene; a-isoamylene; 3-methylbutene-1; 3-Methylbut-1-ene; 2-Methyl-3-butene; (CH3)2CHCH=CH2; CHEBI:77914,4180186
2051502766,2-Methylbutene; Gamma-isoamylene; 1-Isoamylene; 2-Methylbut-1-ene; C2H5C(CH3)=CH2; 2-Methylbutene-1; Isopentenes; Isopentene; CHEBI:77915,4180186
2051502772,Orthophos; Alkron; Alleron; Aphamite; Aqua 9-Parathion; Aralo; Bladan; Bladen; Corothion; Corthione; Danthion; Deoxynucleoside 5'-triphosphate; Diethyl 4-nitrophenyl phosphorothionate; Diethyl O-p-nitrophenyl phosphorothioate; Diethyl O-p-nitrophenyl phos,4180186
2051502773,SDOHO:564; Family_Support,4180186
2051502775,H2N-CH2-COOH; Hgly; Leimzucker; Padil; Glykokoll; G; Glycosthene; Aminoethanoic acid; Aminoethanoate; Glycolixir; Gly; Glycocoll; Glicoamin; 2-Aminoacetate; 2-Aminoacetic acid; Aminoessigsaeure; Aminoacetic acid; Aminoacetate; Amino-Acetic acid; Amino-Ace,4180186
2051502776,Ala; alpha-Alanine; alpha-Aminopropanoate; alpha-Aminopropanoic acid; alpha-Aminopropionate; L-2-Aminopropanoate; alpha-Aminopropionic acid; L-(+)-Alanine; L-alpha-Alanine; L-a-Aminopropionate; L-alpha-Aminopropionate; L-\u03b1-alanine; L-a-Aminopropionic,4180186
2051502777,Epirubicinum; Epirubicine; Epirubicina; 4'-Epiadriamycin; Pidorubicinum; Epirubicin Ebewe; Epiadriamycin; Ellence; Pidorubicine; Pharmorubicin; Pidorubicina; CHEBI:47898,4180186
2051502778,"Oracea; Periostat; Supracyclin; Vibramycin; Vibra-Tabs; 5-Hydroxy-alpha-6-deoxytetracycline; 6-alpha-deoxy-5-oxytetracycline; (4S,4AR,5S,5ar,6R,12as)-4-(dimethylamino)-3,5,10,12,12a-pentahydroxy-6-methyl-1,11-dioxo-1,4,4a,5,5a,6,11,12a-octahydrotetracene-",4180186
2051502780,(-)-Serine; (S)-2-Amino-3-hydroxypropanoic acid; (S)-a-Amino-b-hydroxypropionate; (S)-a-Amino-b-hydroxypropionic acid; (S)-alpha-Amino-beta-hydroxypropionate; (S)-alpha-Amino-beta-hydroxypropionic acid; (S)-b-Amino-3-hydroxypropionate; (S)-b-Amino-3-hydro,4180186
2051502781,"Rcra waste number U089; Stilbetin; alpha,Alpha'-diethyl-(e)-4,4'-stilbenediol; DES; Diethylstilbesterol; Diethylstilbestrol BP; Diethylstilbestrolum; Diethylstilboesterol; 4,4'-dihydroxy-\u03b1,\u03b2-diethylstilbene; 4,4'-Dihydroxy-alpha,beta-diethylstil",4180186
2051502782,"1,2-Benzanthracene; 1, 2-Benzoanthracene; 1, 2-Benzanthracene; Tetraphene; Naphthanthracene; Benzaanthracene; Benzobphenanthrene; Benzoaphenanthrene; Benzoanthracene; Benzo(b)phenanthrene; Benzo(a)anthracene; Benzanthrene; Benzanthracene; Benz(a)anthracen",4180186
2051502789,SDOHO:566; Friend_Support,4180186
2051502792,Adenylpyrophosphoric acid; Adephos; Adetol; Adynol; Atipi; ATP; Atriphos; Cardenosine; Fosfobion; Triphosphoric acid adenosine ester; Triphosphaden; Triadenyl; Striadyne; Phosphobion; Myotriphos; Glucobasin; 5'-(Tetrahydrogen triphosphate) Adenosine; 5'-A,4180186
2051502794,"3-Chloro-4-methyl-7-coumarinyl diethyl phosphorothioate, 3-Chloro-4-methyl-7-hydroxycoumarin diethyl thiophosphoric acid ester; Phosphorothioic acid, O-(3-chloro-4-methyl-2-oxo-2H-1-benzopyran-7-yl) O,O-diethyl ester; O-(3-chloro-4-Methyl-2-oxo-2H-chromen",4180186
2051502795,"Chlorsig; Cloramfenicol; D-(-)-2,2-Dichloro-N-(beta-hydroxy-alpha-(hydroxymethyl)-P-nitrophenylethyl)acetamide; D-(-)-threo-1-P-Nitrophenyl-2-dichloroacetylamino-1,3-propanediol; Fenicol; Globenicol; Halomycetin; Levomicetina; Levomycetin; Oleomycetin; Si",4180186
2051502796,"Bulbold; E 422; Emery 916; Glyceol Opthalgan; Tryhydroxypropane; Trihydroxypropane; RG-S; Propanetriol; Pricerine 9091; Osmoglyn; Mackstat H 66; Incorporation factor; IFP; Glysanin; Glyrol; Glycyl alcohol; Glyceritol; Glycerine; Glycerin; 1,2,3-Trihydroxy",4180186
2051502797,"D-(+)-Glyceraldehyde; alpha,beta-Dihydroxypropionaldehyde; 2,3-Dihydroxypropionaldehyde; D-Aldotriose; D-Glyceraldehyde; D-Glycerose; delta-(+)-Glyceraldehyde; 2,3-Dihydroxypropanal; (+/-)-Glyceraldehyde; (+/-)-2,3-dihydroxy-Propanal; delta-2,3-Dihydroxyp",4180186
2051502799,"Levoglutamida; (2S)-2,5-diamino-5-oxopentanoate; (2S)-2,5-diamino-5-oxopentanoic acid; (2S)-2-amino-4-carbamoylbutanoate; (2S)-2-amino-4-carbamoylbutanoic acid; (S)-2,5-Diamino-5-oxopentanoate; (S)-2,5-Diamino-5-oxopentanoic acid; 2-Aminoglutaramic acid; ",4180186
2051502800,alpha-Aminoglutaric acid; Aminoglutarate; Aminoglutaric acid; E; Glt; L-a-Aminoglutarate; L-(+)-Glutamic acid; L-(+)-Glutamate; Glutaton; L-alpha-Aminoglutarate; L-a-Aminoglutaric acid; 2-Aminopentanedioate; 2-Aminopentanedioic acid; a-Aminoglutarate; a-A,4180186
2051502801,Antivert; Bonamine; Navicalm; Bonine; Chiclida; Dramamine; Meclicot; Sea-Legs; Postafen; Meclozine; Nevidoxine; CHEBI:569632,4180186
2051502802,Phosphagen; ((amino(imino)methyl)(methyl)amino)acetate; ((amino(imino)methyl)(methyl)amino)acetic acid; (alpha-Methylguanido)acetate; (alpha-Methylguanido)acetic acid; (N-methylcarbamimidamido)acetic acid; (\u03b1-methylguanido)acetic acid; alpha-Methylgu,4180186
2051502803,"(+-)-2-Difluoromethyl 1,2,2,2-tetrafluoroethyl ether; Difluoromethyl 1,2,2,2-tetrafluoroethyl ether; Suprane; Desfluranum; Desflurano; 1,1,1,2-Tetrafluoro-2-(difluoromethoxy)ethane; CHEBI:4445",4180186
2051502804,Allyl isosulfocyanate; Allyl isosulphocyanate; Allyl isothiocyanic acid; Allyl mustard oil; Allyl sevenolum; Allylsenevol; Allylsenfoel; Allylsevenolum; Allyspol; Artificial mustard oil; Carbospol; Isothiocyansaeureallylester; Mustard oil; Oil of mustard;,4180186
2051502806,PLM; Univol U332; Pristerene 4934; Prifrac 2960; Prifac 2960; 1-Hexyldecanoate; 1-Hexyldecanoic acid; 1-Pentadecanecarboxylic acid; C16 fatty acid; Cetylic acid; Edenor C16; Emersol 140; Emersol 143; FAT; Glycon P-45; Hexadecanoate; Hexadecanoate (n-C16:0,4180186
2051502807,Stearophanic acid; Stearex Beads; Stearic acid Cherry; Stearinsaeure; Stearophanate; Lunac; N-Octadecanoate; Bonderlube 235; 1-Heptadecanecarboxylic acid; 1-Heptadecanecarboxylate; N-Octadecanoic acid; Flexichem B; Fatty acids C16-18; N-octadecanoic acidd,4180186
2051502825,Vinces; Vincristin; Vincrstine; Vincrystine; Vinlon; Vinracine; Z-D-Val-Lys(Z)-OH; 22-Oxovincaleukoblastin; 22-Oxovincaleukoblastine; Alcavixin; Alcrist; Citomid; Cytocristin; Indole alkaloid; LCR; Leurocristine; Oncocristin; Marqibo; Vincrisin; VIN; VCR;,4180186
2051502826,(-)-strychnine; (\u00e2\u0088\u0092)-Strychnine; Certox; Dolco mouse cereal; Kwik-kil; Mole death; Mouse-nots; Mouse-rid; Mouse-tox; Pied piper mouse seed; Ro-dex; Sanaseed; STR; Stricnina; Strychnin; Strychnos; Strychnidin-10-one; CHEBI:28973,4180186
2051502827,"(\u2212)-morphine; Roxanol; Oramorph; MSIR; MS Contin; Morphium; Morphinum; Morphine Sulfate; Morphina; Morphin; Morphia; Morfina; Kapanol; Kadian; Duramorph; D-(-)-Morphine; Avinza; (7R,7AS,12bs)-3-methyl-2,3,4,4a,7,7a-hexahydro-1H-4,12-methano1benzofuro",4180186
2051502828,SDOHO:574; Access_to_Education,4180186
2051502829,"Diphenylan Sodium; Diphenylhydantoin; Diphenylhydatanoin; Epanutin; Eptoin; 5,5-diphenyltetrahydro-1H-2,4-imidazoledione\t; 5,5-Diphenyltetrahydro-1H-2,4-imidazoledione; 5,5-Dwufenylohydantoina; Dihydantoin; Fenitoina; 5,5-diphenylimidazolidine-2,4-dione;",4180186
2051502830,Petidina; Dolsin; Dolosal; Dolcontral; Dolantin; Demerol; Lydol; Mialgin; Pethidin; P\u00e9thidine; Pethidine dbl; Pethidinum; Petidin; Petydyna; Sauteralgyl; Spasmedal; Spasmodolin; Isonipeca\u00efne; CHEBI:122528,4180186
2051502832,"Barbamyl; Barbamil; Amytal; Amylobarbitone; 5-Ethyl-5-isopentylbarbituric acid; 5-Ethyl-5-isoamylbarbituric acid; 5-Ethyl-5-(3-methylbutyl)-2,4,6(1H,3H,5H)-pyrimidinetrione; 5-Ethyl-5-(3-methylbutyl)barbituric acid; Isomytal; CHEBI:2673",4180186
